{
  "vehicle_equipment":      "TRK-001",
  "reported_problem":       "Engine overheating",
  "diagnosis_cause":        "Low coolant, clogged thermostat",
  "work_performed":         "Replaced thermostat, topped up coolant",
  "parts_used":             "Coolant — Long Life, Oil Filter — Heavy Duty",
  "start_time":             "08:00",
  "end_time":               "11:30",
  "total_time_spent":       "3h 30m",
  "future_recommendations": "Monitor coolant level weekly",
  "remaining_tasks":        "",
  "worker":                 "James Hartwell",
  "company":                "Hartwell Industrial Services",
  "location":               "Main Workshop — Bay 1"
}
